{"build_receipt_id":"d2c32d3f118bd0fa2b8c7778b59a3ffe3957275a811993be09c4534d25fc531e","case_counts":{"failed":1,"passed":2119,"skipped":52,"total":2172},"change_verdict":"FAILED","commands_broad_seal_state":"invalid","counts":{"executed":20,"incomplete":1,"invalidated":0,"promoted":19,"provisional":0,"reused":0},"coverage_plan_digest":"12cfedeff56e5fd62129e2330e3f6281bb1b9a5aa9dbc3a77d2382fe0b6e9251","coverage_scope":"complete","decision_digest":"af11df8bd3e474c7a968f1023732d5fb9cc5afc337a245eb5ff7fa322bcbb4bc","duration_ms":3955407,"entries":[{"artifact_epoch":1,"artifact_read_ids":["artifact.profile"],"artifact_write_ids":["artifact.profile"],"cache_policy":"ExactArtifact","capability_digest":null,"coverage_digest":"633b02c89b7deef1caadbc912441e9575296fde5a20f05ecce9a32be4d1ffe16","duration_ms":657813,"evidence_digest":"a0ad1694e45f1075af258b8337508d9735beeb3169c11db42b86136b3551929a","execution":"executed","id":"tooling.pester-build-toolchain","origin_run_id":"20260913T103734Z-66012-6055b950b9de426fb4e3587e66330fd6","outcome_digest":"1d086fc5d03b86938c790e1b8e3f012a56bf3f0ef1b348e2c8af2015eeb3cbc3","produces_artifact_ids":["artifact.profile"],"promotion_digest":"b29ec807514b4a8961d83fd597dd74c72ef0ac7a3357cf81c46f0fd6b3333ab0","promotion_state":"promoted","reason_codes":["FORCED"]},{"artifact_epoch":1,"artifact_read_ids":["artifact.redsalamander-runtime"],"artifact_write_ids":[],"cache_policy":"ExactArtifact","capability_digest":null,"coverage_digest":"c622c8f77561c04f9922d94da97289a8d8dc66672d7bd65ab378ec67de0c86ec","duration_ms":150312,"evidence_digest":"205c00e9418e19f9b26bef323c170a00270cf09474d340a28f88840fcd0aeced","execution":"executed","id":"selftest.compare-directories","origin_run_id":"20260913T103734Z-66012-6055b950b9de426fb4e3587e66330fd6","outcome_digest":"1d086fc5d03b86938c790e1b8e3f012a56bf3f0ef1b348e2c8af2015eeb3cbc3","produces_artifact_ids":[],"promotion_digest":"5a06be2a33debab0864c8580238538f4d2835d3b3023a63a7b4778fae57db16b","promotion_state":"promoted","reason_codes":["FORCED"]},{"artifact_epoch":1,"artifact_read_ids":["artifact.redsalamander-runtime"],"artifact_write_ids":[],"cache_policy":"ExactArtifact","capability_digest":null,"coverage_digest":"2ff0c5114986c429a934a0bb649a715ad0952445fb3e81d5190b668f6046dce9","duration_ms":0,"evidence_digest":"a59e6dcfbbdf8539071e05fe84d4cfa10ab64d1abfc82c28ea29e6d1b6c55ba4","execution":"executed","id":"selftest.commands","origin_run_id":null,"outcome_digest":"1d086fc5d03b86938c790e1b8e3f012a56bf3f0ef1b348e2c8af2015eeb3cbc3","produces_artifact_ids":[],"promotion_digest":null,"promotion_state":"incomplete","reason_codes":["FORCED"]},{"artifact_epoch":1,"artifact_read_ids":["artifact.redsalamander-runtime"],"artifact_write_ids":[],"cache_policy":"ExactArtifact","capability_digest":null,"coverage_digest":"604b726f95159b6ddab706a86e3ed755182620f72774314ae93df5e57fcabb54","duration_ms":1252121,"evidence_digest":"77f90a1ad5ad1266522eed4f89c05c77df7b1f6ff5f6999ceb292d845ca78b5a","execution":"executed","id":"selftest.file-operations","origin_run_id":"20260913T103734Z-66012-6055b950b9de426fb4e3587e66330fd6","outcome_digest":"1d086fc5d03b86938c790e1b8e3f012a56bf3f0ef1b348e2c8af2015eeb3cbc3","produces_artifact_ids":[],"promotion_digest":"5dac5d53909553d5bc4d31f455d5bd255f346c6248374fcae5e54aef30950f52","promotion_state":"promoted","reason_codes":["FORCED"]},{"artifact_epoch":1,"artifact_read_ids":["artifact.standalone.product-ui"],"artifact_write_ids":[],"cache_policy":"ExactArtifact","capability_digest":null,"coverage_digest":"9e046b4f178f1c11d7e2010bdec0c5d7d8203e80363b3190c126c92394964bb9","duration_ms":2783,"evidence_digest":"b87f39eb26409817c06fbdf09adb1f94516a2e043804b5070a6e4806e078e6bd","execution":"executed","id":"standalone.product-ui","origin_run_id":"20260913T103734Z-66012-6055b950b9de426fb4e3587e66330fd6","outcome_digest":"1d086fc5d03b86938c790e1b8e3f012a56bf3f0ef1b348e2c8af2015eeb3cbc3","produces_artifact_ids":[],"promotion_digest":"d729cf6d8c62ae253e0f7d2fc83fa68f53ab407c142c00b3ea8254e2b1de4372","promotion_state":"promoted","reason_codes":["FORCED"]},{"artifact_epoch":1,"artifact_read_ids":["artifact.viewer-pe-tests-runtime"],"artifact_write_ids":[],"cache_policy":"ExactArtifact","capability_digest":null,"coverage_digest":"cd1a425634ddf6f74f5954ab54af25296c7238b0215c97f353eef74dd69749a1","duration_ms":33497,"evidence_digest":"3880219773c9fb2cd777476d25400c3f50e1845bcd5ba36ff6e6f1aead72b98f","execution":"executed","id":"viewer-pe.noninteractive","origin_run_id":"20260913T103734Z-66012-6055b950b9de426fb4e3587e66330fd6","outcome_digest":"1d086fc5d03b86938c790e1b8e3f012a56bf3f0ef1b348e2c8af2015eeb3cbc3","produces_artifact_ids":[],"promotion_digest":"320c381e31b27c02b708656413bf24ef87efd7d91ba16dba1c0435994d2ab005","promotion_state":"promoted","reason_codes":["FORCED"]},{"artifact_epoch":1,"artifact_read_ids":["artifact.viewer-pe-tests-runtime"],"artifact_write_ids":[],"cache_policy":"ExactArtifact","capability_digest":null,"coverage_digest":"787e0ae90e26a93ecd97e979609e9635bd11ce6b110b6b696e81763170c2e86a","duration_ms":197748,"evidence_digest":"706719a3949f45961ff5ceeb59d875ffda3ab3cf10bac1e59d49b2e3c95e0edd","execution":"executed","id":"viewer-pe.interactive","origin_run_id":"20260913T103734Z-66012-6055b950b9de426fb4e3587e66330fd6","outcome_digest":"1d086fc5d03b86938c790e1b8e3f012a56bf3f0ef1b348e2c8af2015eeb3cbc3","produces_artifact_ids":[],"promotion_digest":"fc82b5f1f1d4e72059adf02bfd4226348774d261355479701b2d83b354d4cb26","promotion_state":"promoted","reason_codes":["FORCED"]},{"artifact_epoch":1,"artifact_read_ids":["artifact.viewer-sqlite-tests-runtime"],"artifact_write_ids":[],"cache_policy":"ExactArtifact","capability_digest":null,"coverage_digest":"110d16ec7251e986586c64495dd75db47fabedba06ed58e1d3a7ee92b568a4ec","duration_ms":11254,"evidence_digest":"e1993b30d160dc22a5814a70b9924ae382e00b455889b9ecc1b4345aa546a124","execution":"executed","id":"viewer-sqlite.noninteractive","origin_run_id":"20260913T103734Z-66012-6055b950b9de426fb4e3587e66330fd6","outcome_digest":"1d086fc5d03b86938c790e1b8e3f012a56bf3f0ef1b348e2c8af2015eeb3cbc3","produces_artifact_ids":[],"promotion_digest":"a5edc97e70efda7bf20fd94d988cf2f8d3e8174014328f8a4e3e6d7505eb4bc7","promotion_state":"promoted","reason_codes":["FORCED"]},{"artifact_epoch":1,"artifact_read_ids":["artifact.viewer-sqlite-tests-runtime"],"artifact_write_ids":[],"cache_policy":"ExactArtifact","capability_digest":null,"coverage_digest":"d5c9d8cbcafeb70a491bdbd6536b4b163a776eab9389d01598ec8f2f04d47a83","duration_ms":6623,"evidence_digest":"7354605d2c75bda04b08f09a7431f047cfb1dbe03375b29492215ce68f9cd396","execution":"executed","id":"viewer-sqlite.interactive","origin_run_id":"20260913T103734Z-66012-6055b950b9de426fb4e3587e66330fd6","outcome_digest":"1d086fc5d03b86938c790e1b8e3f012a56bf3f0ef1b348e2c8af2015eeb3cbc3","produces_artifact_ids":[],"promotion_digest":"b9a1dd969f75f8e6083b62cd24d6e3268244a2cd7a73a8993fcc9959413511f7","promotion_state":"promoted","reason_codes":["FORCED"]},{"artifact_epoch":1,"artifact_read_ids":["artifact.standalone.filesystem-curl"],"artifact_write_ids":[],"cache_policy":"Never","capability_digest":null,"coverage_digest":"549c4479af8c5e2b52a73e7a9e0011e4c80219c4e5970a173d8a9bf4637ac8ea","duration_ms":2905,"evidence_digest":"197c2191c4c0413c5fc27912eadde7c735009a8b90eba202aef787b4f8110b1e","execution":"executed","id":"standalone.filesystem-curl","origin_run_id":"20260913T103734Z-66012-6055b950b9de426fb4e3587e66330fd6","outcome_digest":"1d086fc5d03b86938c790e1b8e3f012a56bf3f0ef1b348e2c8af2015eeb3cbc3","produces_artifact_ids":[],"promotion_digest":"7a96f447741e95df1ddeeb414adfdeab7ff3b4c46573ab2962e2b744a5afb886","promotion_state":"promoted","reason_codes":["FORCED"]},{"artifact_epoch":1,"artifact_read_ids":["artifact.standalone.monitor"],"artifact_write_ids":[],"cache_policy":"ExactArtifact","capability_digest":null,"coverage_digest":"5d6e78c2d6862c281079163a6fc7084dc8c17f16608ad63e89d43e0564c74b99","duration_ms":7782,"evidence_digest":"632dda26c2563a6b0e244164be60b8d2a3896b286e4fffd208dab9a3518bb0da","execution":"executed","id":"standalone.monitor","origin_run_id":"20260913T103734Z-66012-6055b950b9de426fb4e3587e66330fd6","outcome_digest":"1d086fc5d03b86938c790e1b8e3f012a56bf3f0ef1b348e2c8af2015eeb3cbc3","produces_artifact_ids":[],"promotion_digest":"e55536596cd5b471b0891cdd57b18ea75a77d7ba3aecc3d3aa2b129933b9fc77","promotion_state":"promoted","reason_codes":["FORCED"]},{"artifact_epoch":1,"artifact_read_ids":["artifact.standalone.localization"],"artifact_write_ids":[],"cache_policy":"ExactArtifact","capability_digest":null,"coverage_digest":"fa3f9f50099ec4b68db6b400546c43e14161c18ad8c8924f14891d0709182a6f","duration_ms":3249,"evidence_digest":"816a4f3a47412bb11151902fd243a403e8f97ee783937f203e6ae60d418e32f4","execution":"executed","id":"standalone.localization","origin_run_id":"20260913T103734Z-66012-6055b950b9de426fb4e3587e66330fd6","outcome_digest":"1d086fc5d03b86938c790e1b8e3f012a56bf3f0ef1b348e2c8af2015eeb3cbc3","produces_artifact_ids":[],"promotion_digest":"d3153aeb11047241fe7cfa2ba2818b85fabfc9cd8b9a74122874536ba6e59fcf","promotion_state":"promoted","reason_codes":["FORCED"]},{"artifact_epoch":1,"artifact_read_ids":["artifact.standalone.red-configure"],"artifact_write_ids":[],"cache_policy":"ExactArtifact","capability_digest":null,"coverage_digest":"2db8213824e8754075b4a2925100d2731ba4c54970b5502a74ba6de4977debd3","duration_ms":7396,"evidence_digest":"a2da027707c9b23326bb7c11e3d6cd989f1e634b16cf8f4b70008b2d428e44f6","execution":"executed","id":"standalone.red-configure","origin_run_id":"20260913T103734Z-66012-6055b950b9de426fb4e3587e66330fd6","outcome_digest":"1d086fc5d03b86938c790e1b8e3f012a56bf3f0ef1b348e2c8af2015eeb3cbc3","produces_artifact_ids":[],"promotion_digest":"7e31010b69726872daf0a016a947f4830b72087064a1d61d73b5eedf21ce5883","promotion_state":"promoted","reason_codes":["FORCED"]},{"artifact_epoch":1,"artifact_read_ids":["artifact.standalone.plugin-contract"],"a